{
  "data": {
    "end_user_tariff": {
      "id": "cmp-elc-dc-2026-09-peak",
      "currency": "EUR",
      "elements": [
        {
          "price_components": [
            { "type": "ENERGY", "price": 0.71, "step_size": 1 }
          ]
        }
      ],
      "last_updated": "2026-09-17T10:00:00Z"
    },
    "end_user_total_cost": 14.88,
    "currency": "EUR"
  },
  "status_code": 1000,
  "status_message": "Success",
  "timestamp": "2026-09-17T10:00:02Z"
}
